{
  "eventName": "봄철 민감 피부 진정 앰플 체험 이벤트",
  "objective": "신제품 앰플 인지도 확보 및 체험 신청 유도",
  "target": "환절기 민감 피부로 진정 케어 제품을 찾는 20~35세 여성",
  "channels": [
    "instagram",
    "blog"
  ],
  "schedule": {
    "startDate": "2026-05-15",
    "endDate": "2026-05-22",
    "publishDate": "2026-05-15"
  },
  "offer": "이벤트 기간 동안 진정 앰플 체험 신청 시 3일 체험 키트 제공",
  "references": [
    "맑고 투명한 유리 용기",
    "수분감 있는 클린 뷰티 무드",
    "하얀 배경 위 깨끗한 제품 중심 구성"
  ],
  "requiredPhrases": [
    "민감 피부 진정 케어",
    "체험 신청",
    "한정 수량"
  ],
  "bannedWords": [
    "기적",
    "완치",
    "100% 보장",
    "무조건"
  ]
}
